{
  "$schema": "https://openajang.nedpals.xyz/schema/0.1/event.json",
  "type": "event",
  "id": "https://community.example.org/events/meetup-2027-01",
  "url": "https://community.example.org/events/meetup-2027-01",
  "title": "Community Meetup, January 2027",
  "summary": "The first community meetup of the year.",
  "status": "scheduled",
  "starts_at": "2027-01-16T18:30:00+08:00",
  "ends_at": "2027-01-16T21:00:00+08:00",
  "organizer": {
    "name": "Example Community",
    "url": "https://community.example.org/"
  },
  "location": {
    "type": "physical",
    "physical": {
      "name": "Example Hall",
      "address": {
        "locality": "Davao City",
        "country": "PH"
      }
    }
  },
  "registration": {
    "required": false,
    "status": "open"
  },
  "updated_at": "2026-10-30T09:00:00Z",
  "publisher": {
    "name": "Example Community"
  }
}
