{
  "$schema": "https://openajang.nedpals.xyz/schema/0.1/event.json",
  "type": "event",
  "id": "https://gdg.community.dev/events/details/google-gdg-belgrade-presents-devfest-2026-hackathon/",
  "url": "https://gdg.community.dev/events/details/google-gdg-belgrade-presents-devfest-2026-hackathon/",
  "title": "DevFest 2026 Hackathon",
  "summary": "A two-day GDG Belgrade hackathon for participants aged 18 to 26.",
  "description": "The DevFest 2026 Hackathon is a two-day in-person competition organized by GDG Belgrade. Teams of three or four participants develop and present a project; individual applicants may be matched into teams. Working language is Serbian; presentations are in English. Age, prerequisite conference attendance, and team requirements are stated in the registration instructions.",
  "language": "en",
  "status": "scheduled",
  "starts_at": "2026-10-10T09:30:00+02:00",
  "ends_at": "2026-10-11T21:30:00+02:00",
  "organizer": {
    "name": "GDG Belgrade",
    "url": "https://gdg.community.dev/gdg-belgrade/"
  },
  "location": {
    "type": "physical",
    "physical": {
      "name": "Naučno-tehnološki park",
      "address": {
        "street": "Veljka Dugoševića 54",
        "locality": "Belgrade",
        "postal_code": "11050",
        "country": "RS"
      }
    }
  },
  "registration": {
    "required": true,
    "url": "https://forms.gdg-belgrade.com/",
    "status": "open",
    "instructions": "Applicants must be aged 18 to 26 and attend the DevFest Conference on October 9. Teams have three or four members; individuals may apply and be matched."
  },
  "tags": [
    "DevFest",
    "hackathon",
    "software development",
    "GDG"
  ],
  "series": {
    "id": "https://developers.google.com/community/devfest",
    "title": "DevFest",
    "url": "https://developers.google.com/community/devfest"
  },
  "updated_at": "2026-10-29T08:00:00Z",
  "extensions": {
    "openajang:eligibility-unstable": {
      "minimum_age": 18,
      "maximum_age": 26
    },
    "openajang:participation-unstable": {
      "minimum_team_size": 3,
      "maximum_team_size": 4,
      "individual_matching_available": true,
      "prerequisite": "Attendance at the DevFest Conference on October 9, 2026"
    },
    "openajang:event-languages-unstable": {
      "working": [
        "sr"
      ],
      "presentations": [
        "en"
      ]
    }
  },
  "publisher": {
    "name": "Example fixture publisher"
  }
}
