{
  "$schema": "https://openajang.nedpals.xyz/schema/0.1/event.json",
  "type": "event",
  "id": "https://community.example.org/events/build-night-2026-11",
  "url": "https://community.example.org/events/build-night-2026-11",
  "title": "Community Build Night, November 2026",
  "summary": "An evening of hands-on project work with the Example Community.",
  "status": "scheduled",
  "starts_at": "2026-11-14T18:00:00+08:00",
  "ends_at": "2026-11-14T20:00:00+08:00",
  "organizer": {
    "name": "Example Community",
    "url": "https://community.example.org/"
  },
  "location": {
    "type": "physical",
    "physical": {
      "name": "Riverside Library Meeting Room",
      "address": {
        "locality": "Davao City",
        "country": "PH"
      }
    }
  },
  "registration": {
    "required": true,
    "status": "open",
    "url": "https://community.example.org/events/build-night-2026-11/register"
  },
  "updated_at": "2026-10-28T10:00:00Z",
  "publisher": {
    "name": "Example Community"
  }
}
