{
  "$schema": "https://openajang.nedpals.xyz/schema/0.1/event.json",
  "type": "event",
  "id": "https://gdg.community.dev/events/details/google-gdg-kuala-lumpur-presents-devfest-kuala-lumpur-2026/",
  "url": "https://gdg.community.dev/events/details/google-gdg-kuala-lumpur-presents-devfest-kuala-lumpur-2026/",
  "title": "DevFest Kuala Lumpur 2026",
  "summary": "GDG Kuala Lumpur's community-driven developer conference at Sunway University.",
  "description": "DevFest Kuala Lumpur returns for its fifteenth year with knowledge exchange, networking, and learning focused on Google developer technologies. The schedule and speaker lineup have not yet been published.",
  "language": "en",
  "status": "scheduled",
  "starts_at": "2026-11-14T08:30:00+08:00",
  "ends_at": "2026-11-14T18:00:00+08:00",
  "organizer": {
    "name": "GDG Kuala Lumpur",
    "url": "https://gdg.community.dev/gdg-kuala-lumpur/"
  },
  "location": {
    "type": "physical",
    "physical": {
      "name": "Sunway University",
      "address": {
        "street": "5 Jalan Universiti",
        "locality": "Petaling Jaya",
        "postal_code": "47500",
        "country": "MY"
      }
    }
  },
  "registration": {
    "required": true,
    "url": "https://gdg.community.dev/events/details/google-gdg-kuala-lumpur-presents-devfest-kuala-lumpur-2026/",
    "status": "not_yet_open",
    "instructions": "Registration has not started yet. Check the event page for updates."
  },
  "tags": [
    "DevFest",
    "AI",
    "Android",
    "Firebase",
    "Flutter",
    "Google Cloud",
    "web development",
    "community conference"
  ],
  "series": {
    "id": "https://developers.google.com/community/devfest",
    "title": "DevFest",
    "url": "https://developers.google.com/community/devfest"
  },
  "updated_at": "2026-10-29T08:00:00Z",
  "publisher": {
    "name": "Example fixture publisher"
  }
}
