{
  "$schema": "https://openajang.nedpals.xyz/schema/0.1/event.json",
  "type": "event",
  "id": "https://reactsummit.us/",
  "url": "https://reactsummit.us/",
  "title": "React Summit US 2026",
  "summary": "A hybrid React conference with an in-person and streamed day followed by a separate virtual day.",
  "description": "React Summit US 2026 takes place on November 17 at Liberty Science Center and virtually, followed by a fully virtual conference day on November 20. Workshops are offered separately during the month.",
  "language": "en",
  "status": "scheduled",
  "starts_at": "2026-11-17",
  "ends_at": "2026-11-20",
  "organizer": {
    "name": "GitNation",
    "url": "https://gitnation.com/"
  },
  "location": {
    "type": "hybrid",
    "physical": {
      "name": "Liberty Science Center",
      "address": {
        "street": "222 Jersey City Boulevard",
        "locality": "Jersey City",
        "region": "NJ",
        "postal_code": "07305",
        "country": "US"
      },
      "instructions": "Physical attendance is on November 17 only. November 20 is virtual only. The November 17–20 range does not assert conference activity on November 18 or 19."
    },
    "virtual": {
      "url": "https://reactsummit.us/",
      "platform": "GitNation",
      "instructions": "Virtual access details are provided through the event and ticketing pages."
    }
  },
  "registration": {
    "required": true,
    "url": "https://reactsummit.us/",
    "status": "open",
    "instructions": "Attendance mode and dates depend on the ticket. Regular: physical November 17 and remote November 20. Remote: online November 17 and 20. Workshops are offered separately."
  },
  "tickets": [
    {
      "id": "react-summit-regular",
      "name": "React Summit US, Regular",
      "description": "Physical admission on November 17 and remote admission on November 20.",
      "price": {
        "amount": "990",
        "currency": "USD"
      },
      "availability": "available",
      "url": "https://reactsummit.us/",
      "seller": {
        "name": "GitNation",
        "url": "https://gitnation.com/"
      }
    },
    {
      "id": "react-summit-remote-early-bird",
      "name": "Remote React Summit, Early Bird",
      "description": "Remote admission on November 17 and November 20.",
      "price": {
        "amount": "190",
        "currency": "USD"
      },
      "availability": "available",
      "url": "https://reactsummit.us/",
      "seller": {
        "name": "GitNation",
        "url": "https://gitnation.com/"
      }
    }
  ],
  "tags": [
    "React",
    "JavaScript",
    "web development",
    "software conference"
  ],
  "updated_at": "2026-10-29T08:00:00Z",
  "extensions": {
    "unstable:components": [
      {
        "name": "In-person and streamed day",
        "starts_at": "2026-11-17",
        "location": {
          "type": "hybrid",
          "physical": {
            "name": "Liberty Science Center",
            "address": {
              "street": "222 Jersey City Boulevard",
              "locality": "Jersey City",
              "region": "NJ",
              "postal_code": "07305",
              "country": "US"
            }
          },
          "virtual": {
            "url": "https://reactsummit.us/",
            "platform": "GitNation"
          }
        }
      },
      {
        "name": "Remote day",
        "starts_at": "2026-11-20",
        "location": {
          "type": "virtual",
          "virtual": {
            "url": "https://reactsummit.us/",
            "platform": "GitNation"
          }
        }
      }
    ]
  },
  "publisher": {
    "name": "Example fixture publisher"
  }
}
